{
  "schema_version": 1,
  "idempotency_key": "d01-synthetic-create",
  "task_id": "01K00000000000000000000001",
  "expected_task_version": 1,
  "question": "Synthetic comparison: preserve explicit human decisions.",
  "git_revision": "bbbbbbbbbbbbbbbbbbbbbbbbbbbbbbbbbbbbbbbbbbbbbbbbbbbbbbbbbbbbbbbb",
  "workspace_policy_version": 2,
  "project_policy_version": 2,
  "repository_config_version": 2,
  "participants": [
    {
      "agent_profile_id": "01K00000000000000000000002",
      "agent_profile_version": 1,
      "runner_id": "01K00000000000000000000004",
      "checkout_id": "01K00000000000000000000005"
    },
    {
      "agent_profile_id": "01K00000000000000000000003",
      "agent_profile_version": 1,
      "runner_id": "01K00000000000000000000004",
      "checkout_id": "01K00000000000000000000005"
    }
  ],
  "rounds": 1,
  "duration_seconds": 60
}
